<?xml version="1.0" encoding="UTF-8"?>
<dams xmlns:xs="http://www.w3.org/2001/XMLSchema-Instance" xs:noNamespaceSchemaLocation="examenSchemas.xsd" province="Granada">

    <source>http://sig.mapama.es/snczi/visor.html</source>

    <dam name="Laguna de las Yeguas">
        <administrative_data>
            <owner>State</owner>
            <potential_risk_category>C</potential_risk_category>
            <construction_end>1977-01-01</construction_end>
        </administrative_data>

        <geographical_data>
            <river>Dílar</river>
            <town>Dílar</town>
            <hydrographic_basin>Guadalquivir</hydrographic_basin>
        </geographical_data>

        <dam_features>

            <type>Loose materials</type>

            <crest_elevation>
                <value>2900</value>
                <unit>m</unit>
            </crest_elevation>

            <height_from_foundations>
                <value>21.4</value>
                <unit>m</unit>
            </height_from_foundations>

            <crest_length>
                <value>211</value>
                <unit>m</unit>
            </crest_length>

            <foundations_peak>
                <value>2878.6</value>
                <unit>m</unit>
            </foundations_peak>
            
            <bed_level>
                <value>2882.8</value>
                <unit>m</unit>
            </bed_level>

        </dam_features>

        <image>lagunayeguas.jpg</image>
    </dam>

    <dam name="Béznar">
        <administrative_data>
            <owner>Junta de Andalucía</owner>
            <potential_risk_category>A</potential_risk_category>
            <construction_end>1986-12-31</construction_end>
        </administrative_data>

        <geographical_data>
            <river>Ízbor</river>
            <town>El Pinar</town>
            <hydrographic_basin>Cuenca Mediterránea Andaluza</hydrographic_basin>
        </geographical_data>

        <dam_features>

            <type>Arch</type>

            <crest_elevation>
                <value>489</value>
                <unit>m</unit>
            </crest_elevation>

            <height_from_foundations>
                <value>134.0</value>
                <unit>m</unit>
            </height_from_foundations>

            <crest_length>
                <value>408</value>
                <unit>m</unit>
            </crest_length>

            <foundations_peak>
                <value>354.8</value>
                <unit>m</unit>
            </foundations_peak>
            
            <bed_level>
                <value>379.8</value>
                <unit>m</unit>
            </bed_level>

        </dam_features>

        <image>beznar.jpg</image>
    </dam>

    <dam name="Los Bermejales">
        <administrative_data>
            <owner>State</owner>
            <potential_risk_category>A</potential_risk_category>
            <construction_end>1958-01-01</construction_end>
        </administrative_data>

        <geographical_data>
            <river>Cacín</river>
            <town>Arenas del Rey</town>
            <hydrographic_basin>Guadalquivir</hydrographic_basin>
        </geographical_data>

        <dam_features>

            <type>Gravity</type>

            <crest_elevation>
                <value>831</value>
                <unit>m</unit>
            </crest_elevation>

            <height_from_foundations>
                <value>67.19</value>
                <unit>m</unit>
            </height_from_foundations>

            <crest_length>
                <value>408</value>
                <unit>m</unit>
            </crest_length>

            <foundations_peak>
                <value>769.0</value>
                <unit>m</unit>
            </foundations_peak>
            
            <bed_level>
                <value>775.35</value>
                <unit>m</unit>
            </bed_level>

        </dam_features>

        <image>bermejales.jpg</image>
    </dam>

</dams>